{
  "$schema": "./indices-derivados.schema.json",
  "schema_version": 2,
  "gerado_em": "2026-07-17",
  "diretorio_dados": "ferramentas/pesquisa/vade-mecum/data",
  "gerador": {
    "caminho": "ferramentas/manutencao/gerar_indices_derivados.py",
    "versao": "1.0.0",
    "algoritmo": "tokens-significativos-v1",
    "modelo": null,
    "prompt": null,
    "parametros": {
      "normalizacao": "NFD, remoção de diacríticos, minúsculas",
      "tamanho_minimo_token": 3,
      "stopwords": "pt-juridico-v1",
      "ordem": "primeira ocorrência no enunciado",
      "duplicatas": "removidas por registro"
    }
  },
  "legislacao": {
    "padrao_fonte": "lei_*.json",
    "subdiretorio_destino": "indices",
    "sufixo_destino": "_keywords.json",
    "gerado_em": "2026-07-19",
    "gerador": {
      "caminho": "ferramentas/manutencao/gerar_indices_derivados.py",
      "versao": "1.0.0",
      "algoritmo": "tokens-texto-integral-v1",
      "modelo": null,
      "prompt": null,
      "parametros": {
        "normalizacao": "NFD, remoção de diacríticos, minúsculas",
        "tamanho_minimo_token": 3,
        "stopwords": "nenhuma — fidelidade à busca em texto integral do motor",
        "ordem": "primeira ocorrência no texto do dispositivo",
        "duplicatas": "removidas por dispositivo",
        "escopo": "dispositivos fora do índice curado indexes.keywords do diploma"
      }
    }
  },
  "vigencia": {
    "padrao_fonte": "lei_*.json",
    "subdiretorio_destino": "indices",
    "sufixo_destino": "_vigencia.json",
    "gerado_em": "2026-08-01",
    "gerador": {
      "caminho": "ferramentas/manutencao/gerar_indice_vigencia.py",
      "versao": "1.0.0",
      "algoritmo": "anotacoes-planalto-v1",
      "modelo": null,
      "prompt": null,
      "parametros": {
        "fonte_do_dado": "anotações de alteração que o Planalto publica entre parênteses dentro do texto compilado; nada é inferido, e cada evento preserva a anotação em literal",
        "tipos": "redacao, inclusao, revogacao, renumeracao, vigencia, veto, supressao",
        "fora_de_escopo": "remissões (Vide ...), que apontam outro texto em vez de registrar mudança sofrida; e o texto das redações anteriores, que a base não guarda",
        "ancora": "unidade em que a anotação está (caput, § N, inciso N, alínea N, parágrafo único), pelo marcador de início de linha imediatamente anterior",
        "situacao": "só se propaga ao artigo quando a anotação está no caput; nunca vale vigente, que a fonte não afirma",
        "diploma": "espécie, número e ano lidos literalmente da anotação; ano nulo quando a fonte escreve o ano com dois dígitos (331 anotações), sem completar o século",
        "residuo_declarado": "2 anotações em 32.074 (0,006%) ficam sem diploma extraído porque a fonte omite a espécie normativa (\"Redação dada pela nº 9.099, de 1995\")"
      }
    }
  },
  "conjuntos": {
    "sumulas_stj": {
      "fonte": "sumulas_stj.json",
      "destino": "sumulas_keywords.json",
      "colecao": "sumulas",
      "campos_texto": ["enunciado"],
      "campos_copiados": ["numero", "area", "tema"],
      "prefixo_id": "SUM"
    },
    "sumulas_stf": {
      "fonte": "sumulas_stf.json",
      "destino": "sumulas_stf_keywords.json",
      "colecao": "sumulas",
      "campos_texto": ["enunciado"],
      "campos_copiados": ["numero", "area"],
      "prefixo_id": "SUM"
    }
  }
}
